Title,Source,URL,Date,Language,Relevance,Sentiment,Category,Key Entities,Brief
"Morgan Stanley warns an AI breakthrough is coming in 2026 — and most of the world isn't ready",Fortune,https://fortune.com/2026/03/13/elon-musk-morgan-stanley-ai-leap-2026/,2026-03-13,en,9,positive,business,"Morgan Stanley; Elon Musk; OpenAI; GPT-5.4; GDPVal","Morgan Stanley прогнозирует крупный прорыв в AI в 2026 году. GPT-5.4 Thinking от OpenAI достиг 83% на бенчмарке GDPVal."
"Three charged in the US with smuggling AI chips into China",Al Jazeera,https://www.aljazeera.com/news/2026/3/20/three-charged-in-the-us-with-smuggling-ai-chips-into-china,2026-03-20,en,8,negative,regulation,"Super Micro Computer; US DOJ; China","Трое лиц обвинены в контрабанде AI-технологий в Китай на сумму $2.5 млрд в нарушение экспортного контроля."
"President Donald J. Trump Unveils National AI Legislative Framework",The White House,https://www.whitehouse.gov/articles/2026/03/president-donald-j-trump-unveils-national-ai-legislative-framework/,2026-03-20,en,9,positive,regulation,"Trump Administration; White House; US Congress","Национальная законодательная рамка для AI — баланс инноваций с защитой интересов граждан."
"How AI Is Driving Revenue, Cutting Costs and Boosting Productivity for Every Industry in 2026",NVIDIA Blog,https://blogs.nvidia.com/blog/state-of-ai-report-2026/,2026-03-09,en,8,positive,business,"NVIDIA; State of AI 2026","AI стал критической инфраструктурой для всех индустрий. Фокус на ROI от AI-решений."
"The biggest AI stories of the year (so far)",TechCrunch,https://techcrunch.com/2026/03/13/the-biggest-ai-stories-of-the-year-so-far/,2026-03-13,en,7,neutral,opinion,"NVIDIA; Meta; OpenAI; OpenClaw","Обзор ключевых AI-событий 2026: приобретения, рост OpenClaw, дебаты о регулировании."
"AI Update, March 20, 2026: AI News and Views From the Past Week",MarketingProfs,https://www.marketingprofs.com/opinions/2026/54448/ai-update-march-20-2026-ai-news-and-views-from-the-past-week,2026-03-20,en,7,neutral,business,"Google; Gemini","Google рассматривает внедрение рекламы в интерфейс AI-ассистента Gemini."
"Palantir AI to support UK finance operations",AI News,https://www.artificialintelligence-news.com/2026/03/23/palantir-ai-to-support-uk-finance-operations/,2026-03-23,en,8,positive,business,"Palantir; FCA; Foundry; UK","FCA тестирует Palantir Foundry для обнаружения мошенничества среди 42000 финансовых компаний."
"Visa prepares payment systems for AI agent-initiated transactions",AI News,https://www.artificialintelligence-news.com/2026/03/19/visa-prepares-payment-systems-ai-agent-initiated-transactions/,2026-03-19,en,9,positive,product,"Visa; Commerzbank; DZ Bank; Agentic Ready","Visa запускает Agentic Ready в Европе — AI-агенты смогут совершать покупки от имени пользователей."
"DDN, Supermicro, and NVIDIA Launch Driving AI Breakthroughs Experience at GTC 2026",DDN,https://www.ddn.com/press-releases/ddn-supermicro-and-nvidia-launch-driving-ai-breakthroughs-experience-at-gtc-2026/,2026-03-16,en,6,positive,product,"DDN; Supermicro; NVIDIA; GTC 2026","Совместная инициатива AI Factory на GTC 2026 — мобильная AI-фабрика для enterprise."
"До государственной критической инфраструктуры допустят лишь российский ИИ",ComNews,https://www.comnews.ru/content/244324/2026-03-19/2026-w12/1009/do-gosudarstvennoy-kriticheskoy-infrastruktury-dopustyat-lish-rossiyskiy-ii,2026-03-19,ru,9,neutral,regulation,"Россия; КИИ; реестр доверенных моделей ИИ","Законопроект об ИИ в России: только отечественные AI-модели для госсистем и КИИ."
"Я тебя породил, я тебя и приручу. Попытка подчинить ИИ естественному",ComNews,https://www.comnews.ru/content/244349/2026-03-23/2026-w13/1002/ya-tebya-porodil-ya-tebya-i-priruchu-popytka-podchinit-iskusstvennyy-intellekt-estestvennomu,2026-03-23,ru,7,negative,opinion,"AI safety; контроль над ИИ","Нарастающая проблема контроля над AI после стремительного роста внедрения."
"Главное из мира ИИ за неделю (с 1 по 7 марта 2026 года)",Content Review,https://www.content-review.com/articles/73015/,2026-03-08,ru,7,negative,research,"ETH Zurich; Anthropic; Reddit; LinkedIn","AI деанонимизирует пользователей Reddit с точностью 90% через сопоставление с LinkedIn."
"9 событий в мире ИИ, которые завирусились в соцсетях (24 февраля — 9 марта 2026)",Habr,https://habr.com/ru/articles/1008346/,2026-03-09,ru,8,negative,opinion,"OpenAI; Nippon Life Insurance; дата-центры; AI face recognition","Социальный протест: заблокировано строительство дата-центров на ~$100 млрд, иски, ошибки распознавания лиц."
"OpenClaw's ChatGPT moment sparks concern that AI models are becoming commodities",CNBC,https://www.cnbc.com/2026/03/21/openclaw-chatgpt-moment-sparks-concern-ai-models-becoming-commodities.html,2026-03-21,en,9,negative,business,"OpenClaw; ChatGPT","Open-source модель OpenClaw сопоставима с проприетарными аналогами — угроза коммодитизации."
"Mastercard keeps tabs on fraud with new foundation model",AI News,https://www.artificialintelligence-news.com/2026/03/18/mastercard-keeps-tabs-on-fraud-new-foundation-model/,2026-03-18,en,8,positive,product,"Mastercard","Собственная фундаментальная модель Mastercard для борьбы с мошенничеством в реальном времени."
